,Unnamed: 0,Vehicle_Title,Review,Rating,Year,Company
201281,277061,Cavalier Coupe Z24 2dr Coupe (2.4L 4cyl 5M)," Along with the Z24's attractive appierance, it's power and handling capabilities are above average for a car in it's price range. I have only had the car less than a year now and have had a fun time driving it around the town.",4.125,2002.0,Chevrolet
124087,166940,Mustang Coupe V6 Premium 2dr Coupe (4.0L 6cyl 5M)," I was exceptionally impressed with the down and dirty V6.  The Chevy Monte Carlo LT and SS Intimidator have nothing on the 4.0 stock!! I bought an 06 5-speed Pony Edition before I went to college.  It's about 8 months later and the throttle body is havin issues, killing the car about every 30 miles.  The clutch is slipping already, not impressed with that.  The Shaker 500 is really nice, don't crank it too loud though.  The amp for the stereo runs down the factory battery like no other.  It's reliable as heck until the engine starts acting up.  Had the system checked, so I know its the throttle body.  For a car that is four years old, the clutch and induction should not be having trouble.",4.75,2006.0,Ford
116363,157040,GS 350 Sedan 4dr Sedan (3.5L 6cyl 6A), Buy extended warranty always great cars but with it just in case,5.0,2011.0,Lexus
22927,32870,3 Series Sedan 325i Rwd 4dr Sedan (2.5L 6cyl 5M)," I had to chuckel at another review  I  just read. My biggest complaint is how darn much money I put into this car, On the other hamd I drive it hard all year long and use on my sales job. II got it with 88,000 mi and put on 50,000 miles. At least two new sets of brakes. Total overhaul of cooling system that a NMW mechanic did after I messed it up $3200. I took a 6 year long and sure enough I owe nore than the car is worth. Did I say I love to drive it, detail it zoom in the left lane at 90 mph. For now I am going to hang on to it maybe even restore the interior. It has become a hobby, way cheaper than a boat.",3.0,2004.0,BMW
110146,148189,TLX Sedan Technology Package 4dr Sedan (2.4L 4cyl 8AM)," I'll start by saying this car is the lowest priced luxury mid-size on the market, compared to BMW, Lexus, Infinity, Mercedes, and Audi. And that's fair, because this car lacks the style, power, or luxury of those brands. Still, it does have style, power, and luxury, just in more modest amounts.My priorities that led me to buying this car were that I wanted something:~fairly luxurious, but not extravagant in cost~good MPG, and good reliability, to keep the cost-per-mile on my long commute low~modern tech, advanced featuresHaving owned it a year, I'd say it succeeded on the first two points, and failed on the 3rd. My car is indeed about as nice as you'd expect for $35k, it is indeed getting 32-38 mpg depending on the situation, and it is indeed a Honda with rock-solid reliability. I drive a 60 mile round trip daily, and the car does a great job of rolling along with a quiet ride, and a feeling of confidence that it won't break down (like my BMW used to do all the time!). It has a nice amount of pep, the 8 speed tranny can get a lot of power out of those ~206 horses.My complaints are mostly with the tech:~dual screens are confusing, and it's frustrating having to push several touch-screen options in a row to do things as simple as adjust the A/C fan speed.~VERY SLOW on-board computer. Inputting basic commands into the Nav or audio system is maddening. It's sort of a similar feeling to using a first-generation iPhone which is overloaded with too much software. The CPU is too weak to can't handle the demands put on it, so it can take as long as 10 seconds to even react to button presses. 10 seconds is the worst-case, most often it takes more like 1-2 whole seconds to respond, but that is pretty terrible in comparison to the .05 seconds most smartphones take these days. Attempting actions like scrolling the Nav map image often lead to the system nearly crashing, or getting stuck and scrolling way farther than you wanted.~cell phone integration is very weak. It can sync with Pandora on my phone, but it requires several confirmation screens each time you use it, so it's not really worth the trouble. Siri hands free is a joke, you may as well just push the button on your phone and use that instead. ~The tech package supposedly has high-end speakers, but I've found them to be very mediocre, and lacking in bass. The single 8"" open air ""subwoofer"" is not impressive.I'd agree with Edmunds overall rating of the car as a ""B."" That is to say, it's basically what you expect, a low end luxury car. So long as you aren't expecting it to handle like a BMW or ride like a Mercedes, you should be fine. I'd have even given it an A, except for my disappointments with the outdated tech.",4.0,2015.0,Acura
103057,138471,Impreza Wagon Outback Sport AWD 4dr Wagon (2.5L 4cyl 5M)," I had a 1999 Legacy Outback, went to trade it in and found this 2005 Impreza Outback w/14000 miles on it, I liked the style better than the 2008 Impreza Outback.  I bought it as a Subaru CPO car and have never looked back or wanted for something else.  In fact I looked at Mustang V-8's first (nostalgia), drove an Impreza RS and I was totally hooked on the Impreza.  It felt like more of a performance machine than the Mustang.",5.0,2005.0,Subaru
126805,170880,Focus Sedan SE 4dr Sedan," I love my focus, i have had it for a few months and it has been nothing but good. I have heard of all the problems but so far none of them. And I think i may have some electrical problems going on with the radio.. Road noise there isnt much. All around perfect car.",4.75,2000.0,Ford
167689,228594,960 Sedan 4dr Sedan, This is my third Volvo. I buy them for safety. It may be my last though. I am tired of mystery bits of plastic falling off constantly. I've replaced the sunroof twice and the roof still leaks. The cup holders are useless. The leather on the doors is pulling off. The brakes need replacing 1-2 times a year. the driver's visor won't stay up and there is no way to repair it without replacement. It is a comfortable ride and I love the look of the interior. The turning radius is impressive for a car this big and heavy.,4.5,1997.0,Volvo
146604,199344,Aztek SUV AWD 4dr SUV (3.4L 6cyl 4A)," I first bought my AWD Sports Aztek because of 2 friends owning one. I took a ride in it and fell in love. 2 days later, I went and bought one. As ugly as it is, my Aztek is super sporty with a lot of features most don't have.  However, I have had nothing but problems with it (My 2 friends sold theirs a year later and later found out it was documented a ""lemon""). I have 72,000 miles on it right now.  I have replaced both front rotors twice, brakes twice, windshield always leaks,gas mileage is horrible.I fill up every 4 to 5 days (I only drive about 30 miles every day). Rear latch always sticks, tires wear out easily, now the car is shaking and a bad grinding noise which is affecting driving",4.25,2002.0,Pontiac
73788,100855,Santa Fe SUV GLS 4dr SUV (3.3L 6cyl 6A), ,5.0,2013.0,Hyundai
180519,247329,I30 Sedan Touring 4dr Sedan (3.0L 6cyl 4A)," Just picked it up.  Great car from day 1.  Learning to appreciate it more and more every day.  Looks fabulous, great performer, comfortable interior. Althought the suspension is stiffer on the t's the ride is harsh sometimes over the littles bumps you feel it in the cabin.  This car is made well, great looking, and will get many years of pleasure driving it.",4.875,2001.0,INFINITI
9624,13134,Trooper SUV S 4dr SUV 4WD," We have had our Trooper since it was new back in 1998. It is a true trooper. People cannot believe it is a 1998. It looks better than some of the newer cars. I take it everywhere. Just recently the Catalytic Converters went out so I replaced them and the next bothersome thing is the timing belts that need to be replaced every 90,000 miles or so but other than that this car has been reliable and very versatile. I would never want another car. We are taking this to the grave with us. ",4.875,1998.0,Isuzu
31118,45283,Monterey Minivan Convenience 4dr Minivan (4.2L 6cyl 4A)," The van has been good for the 1st year. I had to put new tires and found not a tire usually everywhere. The MPG is not the best. So far I really like the room (3 grandkids) comes in handy, good acceleration when moving into traffic, etc.",4.0,2004.0,Mercury
174705,239487,Grand Caravan Minivan SXT Fwd 4dr Ext Minivan (3.8L 6cyl 4A)," I have to admit that I researched Consumer Reports and based on their recommendation I looked at the Toyota, Honda, and Nissan without giving this vehicle a chance at first. I then decided not to limit my options and tried the Dodge. The Dodge Grand Caravan SXT has a smooth and quiet ride that matches the Toyota and is better by a large margin over the noisy Honda and rattle prone Nissan. A powerful engine that gets excellent gas mileage (I'm averaging 21+ MPG). The SXT is also fully loaded with all the options -including dual power sliding doors. As an added bonus we purchased this van at a great price!  ",5.0,2004.0,Dodge
168663,229939,XC90 SUV 2.5T 4dr SUV (2.5L 5cyl Turbo 5A)," This is the best SUV that I've owned.  Previously I drove a 2000 Mercedes ML320, and the Volvo rides much better, more like a car than an SUV.  It has a good solid feel to it.  I'm 6'4"" tall, and I find the seats very comfortable.  The rear seat leg room is good, and the third row seats can actually be used by an adult.  Power from 2.5L engine is adequate, but it doesn't have as much 'pep' as my Mercedes, which I miss.  If you want more power get the V8 version.  I've been getting about 20 mpg on the highway.  The winter driving mode with the AWD is a nice feature.  I drove home in a substantial snow storm with no problems.  I looked at a lot of vehicles, and this is the best!",4.5,2006.0,Volvo
140569,190654,Explorer SUV Limited 4dr SUV AWD," I bought this 1997 limited Explorer from a private party ONE OWNER with 97,000 miles. with no body damage at all, Excellent interior. With many extras. Like a pone in the center console. Heated seats. Mirrors. Computer display. 10 CD player. Cassette, New Tires. No oil leas, and the V8 5.0 engine. Navigational system. I got it for $3.500. and much more, When I got stationed here at FT Sam Houston, San Antonio TX. So far So Good.  $3.800. I am very pleased.",5.0,1997.0,Ford
93968,126857,Sorento SUV EX 4dr SUV (2.4L 4cyl 6A)," I owned a 2004 Kia Amanti and traded it in for a 2010 Chevy Equinox...loved the gas milage, but gave up too many features I enjoyed in my Kia...so thanks to the special the dealer had I was able to trade in my Chevy for the 2013 Kia Sorento EX...love it...gained all the luxury I was missing and added the peace of mind of the Kia warranty.Gas milage has been great my first tank of gas I averaged 28 mpg which was a mixture of Highway and City miles. Love the bluetooth link to my iPhone and the UVO system is awesome.Lots of room for driver over 6'2"" with plenty of room for back seat passengers....I am so glad I am no longer a Government Motors owner and back in a Kia made in America. :)",5.0,2013.0,Kia
95551,129009,Sephia Sedan LS 4dr Sedan (1.8L 4cyl 5M)," I purchased this vehicle because of its warranty after being talked-down-to by several used car dealers. It gets over 32 mpg, has lots of pick up and speed.  The lumbar support helps my bad back where my former car, a Sable, left me uncofortable after a couple of hours. It has never needed a repair, and fills every need I currently have, including heavy mountain driving and coping with high gas prices. The only two down-sides I can think of are: the body seems to dent easily and it loses some power when the AC is on. Overall, it's a great vehicle for the price and practical as well as comfortable and nicely designed.",4.875,2001.0,Kia
169330,230681,XC60 SUV 3.2 4dr SUV (3.2L 6cyl 6A), Love the car and very comfortable. It's a luxury car with a reasonable price tag. I have Japanese cars all my life and this is my first European car. And I love my decision. Its not too big or too small for a woman driver. ,4.875,2010.0,Volvo
69125,95501,XG350 Sedan L 4dr Sedan (3.5L 6cyl 5A)," I have had this car since 2002..all I want now is another one with all the whistles and bells on the steering wheel.  Talk about great gas!! You'll love it!! It gets a rating of 10 with me! You couldnt ask for more,especially for the price.  Who knows what they will come up with next cant wait to see!!Try it you'll like it!",5.0,2005.0,Hyundai
116284,156961,GS 350 Sedan 4dr Sedan (3.5L 6cyl 6A)," I changed the tires to a Bridgestone with a 45 ration rather than a 40 -- with huge improvement in ride and noise.  But the build quality isn't there - and rattles are getting bad at 30K miles.  Now have learned that rear shocks/struts need replacement.  I am very, very angry.  Finally, the navigation system Toyota makes is simply no good - maps OK, but the lady inside has no sense of direction.  I'm very surprised and disappointed at the reliability factor.",3.5,2007.0,Lexus
117549,159073,RX 350 SUV 4dr SUV AWD (3.5L 6cyl 8A)," My wife has red and I have beige. Love them both. These are our fourth and fifth Lexus we have owned. We tend to keep our cars a long time. These are probably the best cars we have owned. We have had them for four months as of mid-August, 2016. This is in spite of the weird grill, which is an obstacle to overcome. At least the 350 is not as bad as the F Sport, with the really hideous grill. Looks like a monster going down the road with its mouth open and teeth missing.",5.0,2016.0,Lexus
387,789,New Beetle Diesel GLS TDI 2dr Hatchback (1.9L 4cyl Turbodiesel 5M)," I went back to school and needed a more economical car, so I traded my 2000 323i sport/premium for a 2002 Platnum Grey New Beetle GLS TDI.  I love to low end grunt in the city.  I am shocked with the amazing fule mileage.  With the BMW I had to fill up every 6 days or so, with the VW I fill up about every 3 weeks.  I just had it chipped with no degredation of mileage and GOBS of Torque!",4.75,2002.0,Volkswagen
43664,64234,626 Sedan LX 4dr Sedan," is not due to the car. It clearly says in the manaual that while in stop and go traffic, one should have the Overdrive off. only on a long run should overdrive be turned on. People who don't do the above end up ruining their transmission and this true for any car.",4.375,1997.0,Mazda
184003,251552,Town and Country Minivan EX Fwd 4dr Minivan (3.8L 6cyl 4A)," All around good and dependable vehicle.  Replaced driver side window motor at 55,000. All mechanical parts in good running condition.  Great brakes and A/C.",4.625,2001.0,Chrysler
162947,221817,Versa Sedan 1.6 SV 4dr Sedan (1.6L 4cyl CVT), This car is absolutely terrible!!! The handling isn’t good in the rain or snow. The CVT transmission is garbage!!!! I have a 2014 and have only had it for two years and a belt broke and since I was gifted it and it was preowned when bought I have no warranty. It ended up a nightmare to try to fix. $4000 for a new transmission and now it seems a head gasket is blown on the motor and I’m screwed!!! Now I get to buy a new car and carry loads of debt. I’ll be trading this pos in.,1.0,2014.0,Nissan
27138,39243,Escalade SUV 4dr SUV AWD (6.2L 8cyl 6A)," Love my escalade most of my car have been customized to make them suit my taste. The escalade is just right the way it comes. Great power and sound, yet quite and comfortable on the road. And with factory 22' wheels it comands attention where we go.",5.0,2007.0,Cadillac
191547,262799,Malibu Sedan 4dr Sedan (3.1L 6cyl 4A)," In all honesty the 2003 Malibu has been fairly reliable, except for rotors. I made the mistake of getting the rotors machined back to smooth, all this did was to give the rotors a shorter life. Replace rotors if they are warped, do not machine. It's now in with a suspected fuel pump problem. The reason it's at the Canadian tire is I went to the local Chev dealer, and explained I had a loose connection on a wire leading to the fan motor, a simple repair, at $152. I was furious and got the bill reduced substantially. The air conditioning never worked satisfactorily from day one, it cooled but was never cold. The vehicle was just transport",3.5,2003.0,Chevrolet
195299,268787,Silverado 1500 Extended Cab 4dr Extended Cab Rwd SB (4.3L 6cyl 4A)," I bought this truck with 30K miles, and have driven it to 80K with not a single problem. I regularly get 20 MPG on mostly highway driving, and it is comfortable on longer trips. I've also owned a Ford F150 and Ford Ranger, and it's unreal how much more room this extended cab has in it. I can't imagine how much the double cab has. This has been a great ownership experience and I love this truck. I see many with 150-200K miles so I look forward to owning this one for a while.",4.625,2003.0,Chevrolet
77830,106519,Sienna Minivan LE 7-Passenger 4dr Minivan AWD (3.5L 6cyl 6A)," Have loved this van, great get up and go, lots of space, and plows through snow without a problem.",5.0,2014.0,Toyota
28488,41267,SRX SUV Rwd 4dr SUV (4.6L 8cyl 5A)," The Cadillac SRX is a rattle trap.  The moonroof creeks, rattles, and pops.  The front rattles over slight bumps.  My car went to the dealer for a lube job that only lasted for a month and then tje rattles came back.  This vehicle rides like a pickup truck.  It does have plenty of power and handles nicely.  It is not worth the money.",2.75,2005.0,Cadillac
70327,97144,Elantra Hatchback GLS 4dr Hatchback (2.0L 4cyl 5M)," I bought my car about a year ago with 114,000 miles on it. It drove like new. I never had a problem with it. While driving on the highway a deer jumped right out in front of me. I ended up hitting it. At 55 mph the car took the brunt of the impact. It felt as though I had hit a speed bump instead of a 6 point deer. When I got out of the car, and was able to see the damage done to it, I was amazed that no one was hurt. My beautiful car was totaled, but my family and I walked away without a scratch. I am now loyal Hyundai consumer.",4.75,2005.0,Hyundai
81686,111859,RAV4 SUV AWD 4dr SUV (2.0L 4cyl 4A)," I Just purchased my RAV4 after researching for little over 6 months in the mini suv class. This is my first SUV, & I love it. So far, I am a happy first-time toyota driver. The ride is smooth, visibility is great, the stereo sound is perfect. I love the moonroof and overall sporty look of the RAV4 - it definitely stands out from the rest. The gas mileage also has been pretty good. My only complaint is the headrest is uncomfortable, and I am unable to get it to adjust just right.",4.75,2003.0,Toyota
5215,7196,Cabrio Convertible 2dr Convertible," Maybe it's because I bought it used, but overall this car has been a disaster.  It has a clean title and I do a lot of upkeep and it still keeps making its way back into the shop...and repairs are EXPENSIVE.  Parts are not cheap for this car at all.  I have had numerous problems with oxygen sensors and with the cooling system.  My latest woe was having to replace the timing belt and radiator.  It's actually in the shop as I speak...and I made need the catalytic converter replaced....ouch....I'm now in the market for a new vehicle.",3.125,1997.0,Volkswagen
130094,175714,F-150 Regular Cab XL 2dr Regular Cab SB," Bought new in August 98. XL 4.2 V6, 5- speed 3.55 axle, with XLT interior. TX/OK package. Reliability - one of the best vehicles I've owned. Never had a breakdown, only real repair was replacement of turn signal switch. Good power for a 6 cylinder, have towed way more than recommended limit for short distances. Only complaint is fuel economy (lack of). 15-16 MPG in urban driving, 20 on highway cruise at interstate speed. Owned two Chevy p/u's before, this F150 is better truck by far for a work vehicle/tough truck. Chevy's were more confortable, more economical to drive. Gonna miss the old ford when it goes to a new owner shortly. First Ford, was great choice!",4.125,1998.0,Ford
148484,202524,Eclipse Hatchback GS 2dr Hatchback (2.4L 4cyl 5M)," I'm a women in my late 40s and this is the first car I ever got to pick out brand new and buy just because I liked it.  I've had it now over two years and I love it.  I still smile every time I see it in the driveway.  It runs great and is very fun to drive.  My only complaint is that shortly after I bought it, I bumped into a pole (too low to see at my son's baseball field) and it creased the bumper.  I thought for a hit that light, it should have not shown any damage but it did. So I think the body is not very forgiving.  Still wouldn't want anything else, it's a fun car.",4.5,2005.0,Mitsubishi
186202,254678,200 Sedan Limited 4dr Sedan (2.4L 4cyl 9A)," The car is excellent, great mileage, comfortable",5.0,2015.0,Chrysler
49579,71120,Odyssey Minivan LX 4dr Minivan (3.5L 6cyl 5A)," Bought this 02 Odyssey during mid 2002. Roomy, great V6 engine, everything was perfect. Great family vehicle for a few years until the transmission went out on us. It took us a couple of months argueing to get our transmission replaced as the dealer refused too since our warranty was ""expired"". Finally our transmission was replaced since the recall has been issued. Also wind noise was another problem. When cruising in highway speeds. Gas mileage was average. Overall this van is not that bad until the transmission problem kicked in.",3.75,2002.0,Honda
88455,119750,Camry Sedan LE V6 4dr Sedan," Since March, we've been looking to buy a new car to replace this 10 yo Camry.  However, after months of search, we decided to keep it until it breaks.  This car has been unbelievably reliable. After 10+ yrs and 100K, the V6 is still running strong exactly like the day I drove it off the dealer lot. The front brake pads are still the original ones. There are still no rattles or squeaks. It has better interior material than the '07 Camry. I am still getting approx. 23-25 MPG which is inline with (the old) EPA est. We only paid for one unexpected repair for the leaking rack and pinion. It's gonna take a miracle for it's replacement to beat this record.",4.875,1997.0,Toyota
79153,108551,Camry Solara Convertible SLE V6 2dr Convertible (3.3L 6cyl 5A)," Our first ""foreign"" car, and I've been converted. The fit and finish are top-notch. Everything works as advertised. My wife wanted a ""mid-life crisis"" car and this one fills the bill and still has a great back seat for the kids. I don't know how many times it's been mistaken for a BMW, Audi, or Mercedes from the outside, and if you get in you'd still have a problem saying it isn't as nice as any of those.",5.0,2004.0,Toyota
13319,18915,Jimmy SUV SLE 4WD 4dr SUV (4.3L 6cyl 4A)," My 2001 GMC Jimmy SLE is for the most part a reliable vehicle.  Definitely fun in the snow!  Heavy 4wd vehicles are though right.  I'm loyal to this SUV though the worries tell me never to buy another and possibly never another GMC. From a rebuilt transmission, gasket replacement, bearings, and water leaks plus alignments? How should i feel?",3.75,2001.0,GMC
23020,32963,3 Series Coupe 330Ci Rwd 2dr Coupe (3.0L 6cyl 6M), Gorgeous car with the M sports package that comes with the nicest 18 inch wheels out there. Gorgeous interior too and the handling/performance is fantastic. Nicest looking BMW ever made and indeed based on people's reaction to this car it is a head turner. I'm not quite comfortable yet with the attention and stares this vehicle gets.,4.875,2004.0,BMW
188224,257774,XL7 SUV Luxury 4dr SUV AWD w/3rd Row (3.6L 6cyl 5A)," This is a follow-up review I posted at 22,000 miles under the name ""Michael."" Now I have 64,000 miles on this vehicle and am just as impressed as I was back then. I have had almost no problems (still original brakes) and consider the performance superb. The best features are: acceleration, smooth power transfer, handling, stability and reliability. The only repairs I had was to replace the driver's door handle twice and replace the anti-sway bar bushing and links, but this is a small price to pay for an otherwise excellent vehicle. It needs quality tires like Goodyear CS Assurance TripleTred for good handling.",4.5,2008.0,Suzuki
200996,276477,Volt Hatchback 4dr Hatchback (gas/electric hybrid DD), This car is a great car to drive. I have owned the car for 12 months and have used about 12 gallons of gas!I am currently getting about 550MPG. If you dive less than 35 miles per day on average then you can get significantly higher gas mileage than what is published. The car normally runs on electricity until the batteries run low and then automatically switches to a gas powered generator to power the electric motor. The battery will typically give you between 30-40 miles per charge depending on driving habits and outdoor temperature. My average commute per day is about 27 miles. My car is running on battery 95% of the time and uses gas 5% of the time. My favorite car that I have owned.,5.0,2013.0,Chevrolet
164802,224495,XF Sedan Premium 4dr Sedan (5.0L 8cyl 6A), I just drove the car out of the audi dear a jaguar xf S 17 miles down the car lost all the Power I'm in the middle of the freeway 2 seconds later car was in total fire big flames,2.0,2011.0,Jaguar
