,Unnamed: 0,Vehicle_Title,Review,Rating,Year,Company
135057,181829,Fusion Sedan SEL 4dr Sedan (2.3L 4cyl 5M)," I have always wanted a Ford Fusion ever since Ford came out with it.  I was unfortunately in a bad car accident with my 2007 Ford Focus, which was an excellent car as well, and was able to purchase my Fusion.  I am 200% happy with the over all package. Very spacious, great fuel, comfortable.  I have all the bells and whistle on this car and I love it. Great family car even if you are the only one that drives it. I live in the country and drives well in all weather changes the midwest could throw at you.",5.0,2007.0,Ford
51975,73782,Civic Sedan LX 4dr Sedan (1.8L 4cyl 5A)," I am very disappointed in this 07 civic lx sedan with automatic. It does not have enough power, and does not feel stable on the highway. I drove 94 and 97 civics in the past and I am disappointed in this one. The fuel economy is a LIE! This civic only gets about 29 mpg on the highway and 23 in the city.",2.125,2007.0,Honda
63009,87214,A3 Wagon 2.0T 4dr Wagon (2.0L 4cyl Turbo 6M)," Researched the car for over a year and finally test drove an A3 among other brands:  BMW, Volvo, and Acura.  A3 won me over mainly for its fuel economy and the performance - TURBO.  A very capable ""sportswagon"".  Most of my friends couldn't believe how well handled the car is on the road - mine comes with the sports option.  The AudiConcert sound system is quite good.  I can't wait to take this car along the Coastal Hi-Way in Calif.  Nice work, Audi!",5.0,2006.0,Audi
127681,172200,Focus Sedan ZTS 4dr Sedan (2.0L 4cyl 5M)," This car has been the most expensive piece of junk.  I've replaced: the master and slave cylinders, shocks and struts, fuel injector pump, alternator, rack and pinion (TWICE!!!!).  The front doors stick horribly.  The air conditioning unit rusted out.  The enire muffler system fell off.  The ABS brake system only sometimes works and now I can't use the parking brake because it seizes my rear passenger tire and won't allow it to rotate.  It wears unevenly on my tires even though I have had them rotated and balanced.  The air conditioning needs to be recharged every summer.  I'm a mechanical engineer and I take excellent care of my cars.  I will never buy another Ford again.",2.625,2002.0,Ford
198237,272374,HHR Wagon LT 4dr Wagon (2.2L 4cyl 4A), Bought this vehicle brand new and saved $8000.  I love the space for carrying stuff with the fold flat seats.  It allows me to carry my daughter's drum kit.  Very smooth ride.  Swapped in Michelin X-Ice 2 tires.  What a difference it made on icy roads...I'm passing everyone (legally).  Very good on gas.  Was starting to get a sore back sliding down into cars to get in...not anymore! This is the easiest vehicle to get into.  No more sore back!  Fantastic Pioneer sound system with the factory installed sub woofer in the rear. A lot of people have stopped to comment on the great looks and to ask me what I think of the vehicle.  Seriously thinking about getting a second one.  Great warranty too!,4.75,2009.0,Chevrolet
177949,243725,M45 Sedan 4dr Sedan (4.5L 8cyl 5A)," my new M45 is my dream come true. Super fast, sleek, and extremely reliable.  Not only does it look beautiful in black obsidian with willow interior, but it has all the vital safety features that i was looking for, and more! i am so happy with it, that i am telling my friends and familty to go out and buy one. This car rocks!!!",4.875,2003.0,INFINITI
73715,100782,Santa Fe SUV SE 4dr SUV (3.3L 6cyl 5A)," I have been the owner of my 2009 Santa Fe all wheel drive 6 cylinder for approx. 3yrs and I bought it with 38,000 miles. I drive at least 85 miles per day.  First: the 09 Santa Fe drives terrible on the highway. It vibrates terribly and upon bring to dealer they said it was possibly tires or rotation was needed. (I put brand new tires on the vehicle at 45K and at 53k & rotate every year) this never fixed the vibration or the poor handling. Dealership told me I guess that's how it drives and there is nothing they can do. Second: my 09 Santa Fe has a horrible sound system that you can't put up over 14 decibels without blowing a speaker. The volume goes well up to 50. All of the speakers have either blown or went out which I have replaced three times with factory speakers and again they are blown. I have a three year old in the car constant so it's not like I'm blaring rap music with the bass at 10+. Horribly annoying and expensive to fix and not covered.Third & most disturbing: my 09 Santa Fe'a gas gauge malfunctioned at 61,000 miles. After filling my gas tank to a range full line I noticed I drove the car to just above a half tank. After turning car back on the gas gauge needle was buried at empty and gas light on. Very nervous immieditely went to get gas. Only took 18$ to fill. Strange which means it's not empty. Thought was a fluke. Drove to work used 1/4 of tank. Turns car back on after work. Read empty again. After filling the car yet again now using only 8$ I knew there was a issue. I brought to dealer they told me it is electrical. Fully serviced the vehicle through Hyundai.  At the tune of $184.00. Two days later. Started again. After reading on forums this is a severe issue and souls have a recall. It's the tank sensor. Brought back to dealer. They told me to remove old sensors and put new ones it will cost roughly between 500-1000 dollars. It is not covered under warranty and there is no recall. So much for 100K bumper to bumper warranty. This is a severe issue that can cause death or harm. If you don't make sure to reset your miles and keep an eye on your mileage you can run out of gas. The car may even just shut down at high speeds. I would not advise anyone to buy this suv I'm a former Jeep owner and as soon as I get the money to fix the gauge issue I will be selling ASAP and buying either a new jeep or Subaru. The gas mileage is terrible the car vibrates and you don't know if you have gas. Sounds like a death trap to me. Hyundai is putting people at risk with the above issue and should recall the vehicle to fix for free. DO NOT BUY!! Any Sante fa prior to 2011. They all have the same issue",2.0,2009.0,Hyundai
176581,242086,Challenger Coupe R/T 2dr Coupe (5.7L 8cyl 5A)," As a child in 1969 I went with my dad when he picked up a new 1970 Dodge Charger. I sat in an orange car that I later learned was a Challenger.I've owned a lot of cars over the years, including a new 1997 Trans AM WS-6, which is a beautiful car until you have to do any engine work. I can say the Challenger is arguably the best new car I've ever owned.It is huge, it's larger and weighs as much as my truck, a 1st gen 5.9L Durango, yet it gets almost 24 MPG on the Interstate. It has many bells & whistles never thought of in 1970, and it's the best looking retro muscle car in my opinion. Due to size and weight, it's not as fast as the smaller Camaro, but to each their own.",4.75,2009.0,Dodge
191019,262089,Malibu Sedan 4dr Sedan," This is my 9th year with my Malibu. Within the first few years of owning, I regretted every moment of purchasing this car. But 9 years later. It's the best vehicle I have ever owned. Front brakes, a gas sensor & an alternator have been the only problems that I have ever had. Yeah, I don't run the a/c during the summertime (too hard on the engine ~ sounds like the entire engine is going to fall out), and automatic car washes cause water to get in the tail lights (horrible engineering design). But, she starts without fail every day and for that, I love my Malibu. Anxious to get a 2009 though.",3.75,1999.0,Chevrolet
152682,208928,Rogue SUV SV 4dr SUV AWD (2.5L 4cyl CVT)," Purchased this vehicle after owning a Nissan Pathfinder for 10 years, So far we are very happy with the Rogue. Love the handling! Extremely stable on icing roads. Nav system and intelligent key are marvelous. Leather seats very comfortable. I am over 6 feet and find the leg room great. Very happy with our purchase.",5.0,2011.0,Nissan
194860,268167,Silverado 1500 Crew Cab LTZ 4dr Crew Cab 5.8 ft. SB (5.3L 8cyl 4A)," I love the way it is designed in and out.  It is very powerful and quiet ride, with a lot of features.  ",5.0,2007.0,Chevrolet
136401,183939,F-350 Super Duty Crew Cab Lariat 4dr Crew Cab 4WD LB DRW (6.8L 10cyl 6M)," This is the first diesel I've owned and love it. The truck handles very well for the size and the ride is comfortable. Currently not towing anything until the engine has about 10,000 miles on it, and then will tow 12K 5th wheel on weekend getaways.  First tank I averaged 11.5 mpg, second was  13.5, and expect it to get better over time.  ",4.875,2008.0,Ford
186128,254604,200 Sedan Limited 4dr Sedan (2.4L 4cyl 6A), We bought this when after first looking at a VW Beetle. New styling of 200 is refreshing. Interior is classy in black. Lots of power with the V6; I expected there to be more torque steer during spirited driving with 283hp going to front wheels but the traction control keeps TS under control quite well. The mileage could be better but we bought anyways fully knowing what to expect. We traded in a 2010 VW Jetta TDI that had turbo lag the VW dealerships could not resolve.,4.375,2012.0,Chrysler
203480,280500,SS Sedan 4dr Sedan (6.2L 8cyl 6A)," If you're lucky enough to find a manual transmission car, buy it! I traded in a loaded Camaro 2SS for my SS and three years later, I have no regrets. Fun car to drive and I love the mag-ride suspension. The car gets as much attention at cruise nights as a Ferrari and gets close to 30mpg on the highway if you keep it under 70.  Lots of room in this car too, I'm 6'4 and 290lbs, an adult can ride behind me without my moving my seat up.",5.0,2015.0,Chevrolet
40702,60270,CX-7 SUV s Touring 4dr SUV AWD (2.3L 4cyl Turbo 6A)," had a mazda 3 before and now wanted something bigger. transmission and turbo charger went in the first 6 weeks. mazda did replace the vehicle, (very nice customer service there), but the 2nd one is in the shop getting the turbo charger replaced for the 2nd time.  anyone else having troubles?",4.0,2010.0,Mazda
92027,124644,Sedona Minivan SX 4dr Minivan (3.3L 6cyl 6A)," On Purchase:Purchased used with 17k mileage, very happy with it, but will replace OEM (kumbo) tires as they are real noisy.  No DRLs, mileage is 18-19 mpg in city, but great acceleration and brakes.  Watch out when folding up/down 2nd row seats , seatbelt buckle can hinder seat movement to lock in seating position, found out the hard way and mashed the buckle mechanism not knowing it was the problem.  Overall very pleased so far, last van was  2004 Odyssey.3-month follow-up:Follow-up after 3 months - still very impressed with Sedona especially after replacing tires with Bridgestone equivalents (from Costco), now quiet ride.  Transported two twin beds (mattress, box, headboards and rails) all in one trip after moving middle row seats all the way up.  Noticed brakes were not as solid as I braked one time hard with seven passengers onboard and the van didn't quite stop as quick as I wanted as the brakes faded, no harm, but need to have dealer check it out.  All in all, still impressed and pleased with my purchase, will see what my first check-up experience will be with the dealership is like at 30K service.18-month followup:Still enjoying the Kia - no problems to report.  I checked the brakes at the 30K service, dealership said no problems on brakes, but I know that they fade when I brake hard with full van of my 5-6 kids due to weight?  I may replace brake pads soon and hope this remedies this problem.  I really like using the Android Auto with the Kia big screen - works nicely with touchscreen.  I would recommend Kia (this is my first one) and hope the reliability continues.",4.0,2015.0,Kia
67344,93018,Sonata Sedan Sport 4dr Sedan (2.4L 4cyl 6A)," Terrific blending of style, comfort, reliability, and economic performance. Having owned everything from Toyotas and Mustangs to Jaguars and Cadillacs, this mid-sized sedan meets my current needs with flare and driving fun. Plenty of power to merge, pull up the Rocky Mountains, or lay down miles across the wide open spaces of Nevada. Change the oil, occasionally service, gas it up and watch it keep going!",5.0,2015.0,Hyundai
165295,225131,S60 Sedan 2.5T AWD 4dr Sedan (2.5L 5cyl Turbo 5A)," This is a great car...fun to drive, fun to own!  I have gotten all kinds of compliments on its styling and handling.",4.875,2004.0,Volvo
123462,166237,Wrangler SUV Rubicon 2dr SUV 4WD (3.8L 6cyl 6M)," I love my Jeep!  This is the first one I have owned, but when I was little mom had one.  It deff takes me back 20 years and I love it as much now as I did then!  Door off, top down is the best!  Not a lot of power in this little Jeep but I didn't buy it for that.  Handling is really good and ride quality is surprisingly great!",4.75,2007.0,Jeep
39284,58158,Boxster Convertible 2dr Roadster (2.7L 6cyl 5M), Great car. Overall perfect. Porsche could have made it a little faster and more powerfull but overall its a great car. ,5.0,2005.0,Porsche
104211,139970,Century Sedan Standard 4dr Sedan (3.1L 6cyl 4A)," This is my third Century. I cover the state of Ohio, as a saleman, and put about 40,000 miles a year on the car. I can,t say enough about the Century, great ride, and great reliability it's never let me down. The only maintance is oil changes, normal wear items like tires and brakes. To bad this is the last year for the Century. The LaSalle is beautiful but it cost's to much for a guy on a company car plan.",4.625,2004.0,Buick
191783,263225,S-10 Regular Cab 2dr Regular Cab SB," I bought this truck about 10 years ago.  It has been a lifesaver.  Four years ago on a crowded super fast highway that ran through town some maniac going 90+ tried to run my truck and a small SUV off the road.  The two of us sideswiped each other and the perpetrator got away BUT my little truck did not spin out of control or tip over.  It could have.  Both vehicles and all occupants were safe and sound and all I got was a 4-inch dent and a lost side mirror (replaced that).  The flexibility of this truck has been phenomenal. I plan on (when the time comes) to simply put a new engine in it.  But so far, no need.  Two weeks ago I easily (for me) replaced the pulse switch board for the wiper blades but that in essence was all.  It is good on oil.  I take care of it; give it regular maintenance check ups.  No major issues.  Yes, did have an alternator fail a month ago but the original alternator was already 17 years old.  The paint job has held up too.  I did have some AC issues that were handled by two different mechanics but given how heavily I use that part, totally understandable.  This truck has been a workhorse in every sense of the word.  It is my main commuting truck now and I used to use it for my job which required 30-40K miles of driving annually.  It is a stick shift and for that reason I can scoot out of the way when I need to. One update: windshield wipers kept dying on me so I researched it on You Tube and got a 21.00 part and replaced it myself.  All good now.",5.0,1999.0,Chevrolet
69184,95695,"Veloster Hatchback 3dr Hatchback w/Red, Black Interior (1.6L 4cyl 6M)"," We have owned the car for 4 years as its my wifes commuter car. The local dealer ship is one of the worst in the Tallahassee area. They care about the ""sale"" only. The vaunted warranty is worthless. Only covers if all the maint is done at their facility ,so no doing your own oil changes. The car always had something wrong with it from ECU updates to recalls on the glass roof,brakes, leaking headlights. Head unit with radio always had problems from volume knob no longer working  to just cutting off for no reason.  Cruise control  worked when it wanted to which was not all the time . Advertised at 40 mpg but never got better than 32 on interstate commute Resale value was a joke on a miata,but hooray ,its gone",2.0,2012.0,Hyundai
11584,16714,Acadia SUV SLE-2 4dr SUV (3.6L 6cyl 6A)," With our 3rd boy on the way we had to move on from our 2 row Endeavor. Having studied Consumer Reports extensively and donesome somewhat recreational test drives of numerous other vehicles I narrowed our search to the Durango, Acadia, and Sienna. Our priorities that ruled out others such as the Highlander, CX-9, and Explorer were: we had to have captain chairs in the back, good reliability, regular fuel, enough space in the back for kid stuff, MPG better than 18, power lift gate, black/dark intirrior, and good safety features. ",4.75,2014.0,GMC
117257,158772,RX 350 SUV 4dr SUV AWD (3.5L 6cyl 5A)," I purchased my RX350 in Oct. I traded in a  BMW, what a huge mistake. The car has many quality defects and is sub standard in all categories. The tires were out of balance, electrical problems, road noise, wind noise,fit and finish problems. The base audio system is poor. The factory Nav. system came with the ""old"" version of software! For $46K this car is over priced over rated and just a Lexus to forget. It is in the class of a Buick or Cadillac not BMW or MB.Do not purchase one! I will be trading for a BMW or a Benz in the Spring.",2.25,2008.0,Lexus
146434,198990,Aztek SUV Fwd 4dr SUV (3.4L 6cyl 4A), Our heater blowers keep failing.  we are about to get our 6th.  We don't use it much in summer and don't run it on hi very often.  anyone else heard about this? ,3.5,2003.0,Pontiac
90786,122877,Tundra CrewMax Cab SR5 4dr CrewMax SB (4.6L 8cyl 6A)," If you want comfort, protection (in case of accidents) then you got to pay.  I know it is high on the gas end, but you can't get a truck that gives you comfort, protect you and your family members, and can haul stuffs and expect 30MPG.  If that is what you are looking for then buy a Prius!",5.0,2016.0,Toyota
38113,56329,E-Class Diesel E 250 Sport BlueTEC 4dr Sedan (2.1L 4cyl Turbodiesel 7A), Tech -- not very user friendly. Wish I would have not purchased a Black vehicle -- wish it was silver.,5.0,2016.0,Mercedes-Benz
131633,177823,Expedition SUV Eddie Bauer 2WD 4dr SUV (4.6L 8cyl 4A)," I love this vehicle, it is the nicest riding truck I have been in yet. It handles well, and feels very stable. The 4.6 runs very smooth, and could use a little more low end torque for towing, but I will address that myself. What amazes me however is the number of people on here complaining about gas mileage. What did you expect? This is a 5000 lb. vehicle, and I see people gunning them off the line like a sports car. Thats what kills your mileage. If you drive it carefully, you can get 15-16 around town, and 20 or better on the highway. You cant forget what your driving; either you want better mileage or you want more power, you usually can't have both.",4.625,2002.0,Ford
45708,66583,6 Hatchback s 4dr Hatchback (3.0L 6cyl 5M)," I have owned this car for seven years and this was the best car I have ever owned. I is a smooth ride, fast and handles well.",5.0,2004.0,Mazda
19142,27629,X5 SUV 3.0si 4dr SUV AWD (3.0L 6cyl 6A)," I love this car. It drives great in every weather condition. Breaking is awesome, acceleration is moderate, but the steering is pretty restricted. Any BMW feels heavy to drive, which is good, but my Toyota Sequoia has a better turning radius and it's a monster. Also, the rubber material on the handle of the driver and passenger door has melted off from the heat (granted, I live in southern Georgia) and the plastic around the gear shift is ripping. I'm guessing the material just isn't high quality. The car has also given us a few scares on road trips when it starts shutting itself down, and the repairs have been expensive for that. It's unfortunate that our BMW has had so many problems because they are fabulous vehicles! One thing I particularly love about our BMW is the sun roof. If you can get a sun roof, you should. The thing is massive so even the passengers in the backseat can see the sky.",3.0,2007.0,BMW
186281,254757,200 Convertible S 2dr Convertible (3.6L 6cyl 6A)," Purchased it with only 2800 miles on it and it was three years old. I average about six hundred miles a week and the mileage averages 26 to 27, city and highway. 29.9 highway only. Brakes have squeaked in reverse since I've owned it. Torque steer is really bad, you kick it you had better have a grip on the steering wheel. I've only had one warranty issue, the paint on the aluminum hood is bubbling. Dealer was great Chrysler is going to replace and paint a new hood for it. It's a blast to drive and is way more comfortable than the new ones, I've rented a couple of them for work and have issue getting in and out of them without bumping my head. The biggest thing to get used to is the visibility from it being a rag top. The windshield sits a bit too low. But so far I'm happy with it.So now with 79,000 miles on it I'm still quite pleased.",4.0,2011.0,Chrysler
4517,6131,GTI Hatchback 1.8T 2dr Hatchback (1.8L 4cyl Turbo 5M)," The 2003 Volkswagen GTI is a very quick, very peppy car.  It is absolutly a blast to drive and also a very reliable car.  After I'm done with this one, I plan on buying another.",4.75,2003.0,Volkswagen
170659,232513,Neon Sedan SE 4dr Sedan (2.0L 4cyl 5M)," The fuel economy is quite good. Vehicle came with a spoiler on the trunk lid that obstructed rear view and I ended up removing it and plugging the screw holes.  At 38,000 miles the vehicle would not pass a state inspection because the lower control arm bushings seperated from their housing on both sides of the vehicle.  Dealer says he has relaced these failed parts on many Dodge Neon vehicles and on PT Cruisers which have the same suspension.  Had other Chrysler vehicles in the past and will certainly never buy another one.",3.125,2005.0,Dodge
188645,258485,Verona Sedan EX 4dr Sedan (2.5L 6cyl 4A)," The car has been in the shop quite a bit as a result of a stalling / hesitation problem with the engine.  Also, the cruise control has quit working and has been replaced once and will need to be replaced again.  The cruise control is a mechanical unit that sometimes surges significantly once set and poses a safety problem.",2.75,2004.0,Suzuki
116360,157037,GS 350 Sedan 4dr Sedan (3.5L 6cyl 8A), Beautiful car,5.0,2016.0,Lexus
86472,117593,Highlander SUV Sport 4dr SUV AWD (3.5L 6cyl 5A)," Drove and researched everything. Highlander is #1. The Honda Pilot doesn't handle well, the Pathfinder is way too cramped inside, and the Traverse and Acadia are over 40k with options, not worth $. The Highlander is so super quiet, the transmission is ultra smooth. 270 horses pull quickly and I can still get 25 mpg.  Very comfortable driving position with nicely laid out high quality controls. Second row captains chairs are like traveling first class. Third row is cramped and only good for a quick trip. Toyota always was and still is one of best products on the road. Drive the Highlander and you will absolutely be sold.  ",5.0,2009.0,Toyota
116159,156799,RX 300 SUV 4dr SUV AWD," Bought the Lexus Rx 300 because of Lexus' reputation of being a reliable vehicle, sadly disappointed with our experience.We bought this car 5 years ago with 48K miles on it and hoped to drive it over 200K miles. Unforunately at 100K miles the car had a steering column failure, the worst the dealer had ever seen. Car was unsafe to drive. Cost of repairs $1,700. Less than 12 months later at 112K miles the engine went. Expected cost to replace $5,000 for a used engine, significantly more for a new one.Never expected this from Lexus! at 112K miles... are you kidding me. Should have read reviews before buying it. ",3.75,1999.0,Lexus
172511,235702,Ram Pickup 1500 Regular Cab ST 2dr Regular Cab 4WD SB," 2000 4X4 reg./cab/sb:   I've always owned full size trucks and this one was the best.  Mine had the 5.2l V8 and the 5spd tranny.  I can personally attest that it would do a 17.1sec quarter mile and break traction into 3rd gear (not bad for a 4X4).  Extremely rugged truck, Ford and chevy couldn't match.  I used this truck hard for 2 years (30k mi).  I would drop the clutch at 3000 rpm locked up in 4hi with the truck sitting in a foot of sand...I guarantee a Ford or Chevy would've popped.  The only probs with mine were a leaky brake proportioning valve and a bent steering stabilizer that I rebounded off a huge rock...  Both were fixed free under warranty.",4.5,2000.0,Dodge
160403,218912,Altima Sedan GXE 4dr Sedan," Have had nothing to compalin about since I purchased my Altima, used, in April.  Get 24mpg city/33mpg highway.  Nothing but normal mantainance to dat",5.0,1997.0,Nissan
44533,65348,CX-9 SUV Touring 4dr SUV AWD (3.7L 6cyl 6A)," The CX9 is a great crossover.I like the V6 pick up, I like the design, I'm ok with the gas mileage (could be better), but overall this is a very good SUV.I'm unhappy with my dealer...and that doesn't take away from the car.Do not deal with Mazda in Lodi New Jersey out on Route 46.Salesman told me it had satellite radio...little did I know it wasn't in it, just satellite ready.So after shelling out 30K now I have to buy a radio...not kosher.They did not care one bit.So the guy lies to me and that's OK.Get yourself this SUV, just not from Mazda in Lodi.",4.0,2010.0,Mazda
