,Unnamed: 0,Vehicle_Title,Review,Rating,Year,Company
48965,70442,Passport SUV LX 4dr SUV," I bought the 1999 Honda Passport because I had heard what great vehicles Honda made - well guess what it's not a (true) Honda -should have done my homework better!  This has been the worse car I've owned, looking to get rid of it now! Replaced transmission 11/8/4, hmmm bought it 11/18/98. Everything seems to be breaking not only the major things but minor things too!!! Looking to buy a Toyota now....",1.75,1999.0,Honda
118732,160785,RX 400h SUV 4dr SUV AWD (3.3L 6cyl gas/electric hybrid CVT), Especially for mountain driving this car is high performance. I like the low emission which helps the environment and increases the pleasure of driving this car.,4.875,2007.0,Lexus
175158,240203,Grand Caravan Minivan SXT 4dr Ext Minivan (3.8L 6cyl 4A)," Major repairs starting at 5.5 years and 98k miles is not acceptable.  AC died.  Front tie rod issues. Constant 'rattling' on every bump - service dept. never finds an issue.  Serpentine belt never wanted to be a part of the vehicle. I can't believe how quickly it rusted!  Have been driving Fords too, and haven't seen that.  We had enough.  ",3.25,2005.0,Dodge
18854,27282,3 Series Gran Turismo Hatchback 328i xDrive 4dr Hatchback AWD (2.0L 4cyl Turbo 8A)," I had a 2011 BMW 528i. I wish we never got rid of it. I made the mistake of leasing this car for three years. Mine is a 328xi with the M Sport, lighting, premium, driver assistance, technology, and heated front seats. The newest iDrive system has some neat features, but lacks the simplicity of the previous version. The base sound system is actually pretty good. The front seats are okay, but the headrests are uncomfortable at any position. The adjustable bolsters are not overly confining. The way the center console and doors are designed make for some very hard places for resting your knees. There is lots of hard plastics around the center console. The rear seat has much better legroom than my 5, but the sloping roof and small windows take away headroom. The seats are not very soft and fitting 3 in the back is a punishment. Visibility is awful in the back. It has large 19 inch wheels, but it rides adequately. The car is very noisy inside. Lots of road and engine noise come in. The noise makes it difficult to make phone calls, and the Bluetooth is temperamental. The engine is smooth, although at times it will pause, and suddenly lurch forward. It becomes quite nauseating. The engine is extremely unrefined at cold startup. I had the same issue with the 5. For 54K, this is unacceptable. The frameless doors sure look great, and make a solid thud when closed. But be careful, because there are sharp edges, and my mother cut her arm walking by an open front door. The standard panoramic moonroof is massive. It's probably my favorite thing about this car. The xenon headlights are worth the extra cost. My 528i was okay on gas, but this car is not as efficient. I think it's because the car is heavier. It is noticeably less fun than the regular 3. It corners better than my 5 did, but it lacks the solid feel and comfort that I have come to expect from BMW. I will be turning this car in early and considering a better car.",2.0,2015.0,BMW
116493,157170,GS 300 Sedan 4dr Sedan AWD (3.0L 6cyl 6A)," This is now my 3rd Lexus. Prior vehicles were the ES and IS 300's. The GS is by far the most refined of the trio. Before purchasing the GS I test drove both the IS 250 AWD and the ES 350 and although I was impressed with both cars, once I got into and began driving the GS it was then easy to decide this was the car I wanted.",4.875,2006.0,Lexus
101438,136332,Forester Wagon X AWD 4dr Wagon (2.5L 4cyl 5M)," Great wagon, got this last year after selling our minivan.  Gas mileage is better than expected with the manual. Gets 30 mpg easy on the highway.  About 26 city.  AWD is great.  Solid, well made vehicle.  Seats are firm and supportive.",4.625,2005.0,Subaru
191211,262361,Malibu Sedan 4dr Sedan," We have had the engine overhauled.All parts replaced in the entire engine, suspension and exhaust systems.Interior is as plan as it can get.Seat are uncomfortable for long trips.The car could not have been made or designed any worse",1.0,1998.0,Chevrolet
69152,95528,XG350 Sedan 4dr Sedan (3.5L 6cyl 5A)," Having many troubles with the Check Engine light. Local dealer tried 2 times telling me the gas cap was not clicked closed 3 turns. On 3rd visit they found problem with a sensor. Said they fixed.  Problem continues today, one year later. Just Failed NJ state inspection for Emissions. Love the look and comfort but Hate the hassels and under the hood problems.",3.625,2003.0,Hyundai
105679,142353,LaCrosse Sedan CXS 4dr Sedan (3.6L 6cyl 4A)," This automobile has been rattletrap on city streets since I bought it (freeways no problem) Disappointing mileage, good handling. Comfortable to drive, good climate control, lousy floormats.  Inability to fix rattles will cause me to buy a Mercury or Lincoln next time.",4.125,2005.0,Buick
61723,85363,Q3 SUV Prestige quattro 4dr SUV AWD (2.0L 4cyl Turbo 6A)," Love the performance and the connection to the road, the logical interior layout and equipment without stupid extras . My biggest criticism is the height of the media/nav window that you cannot get rid of- cannot fold down or black out. I am 5' talk and it is right at eye level and VERY distracting to drive with, more so at night! If I cannot get used to it... It might make me reconsider the car- which I LOVE on every other level!!!",5.0,2016.0,Audi
49964,71534,Odyssey Minivan LX 4dr Minivan (3.5L 6cyl 5A)," After 30K on an 07 Element, time for more room for the dog.  So far very happy with Odyssey.  I've pulled the middle seats out, rear seats down provide plenty of room for old rover.  Gas mileage so far at 21, i usually cruise LA fwys at 70 mph + no complaints here. hope i don't have to have the new '11. ",4.625,2010.0,Honda
65954,91411,A4 Sedan 2.8 quattro 4dr Sedan AWD," Here is my two cents after putting 50K on my A4 which I purchased at 120K. Very reliable engine, manual transmission (same OEM clutch at 170K), no major electrical problems. What has failed, cruise control, driver side heated seat, thermostat. I believe overall it is a very reliable car, sensors that I have replaced along the way are just the same on all cars these days, all made by BOSCH and it doesn't make a difference which brand you drive. In terms of interior/exterior design, ergonomics and build quality Audi is never any less than other Germans and maybe much better in some of these areas if not all. The up side is because of its reputation here in USA, you can get them much cheaper!!",4.625,1997.0,Audi
13815,19774,Envoy SUV SLT 4WD 4dr SUV (4.2L 6cyl 4A)," I have owned an Envoy for nearly three years and as a former Bronco and Toyota owner I remain as pleased with it as when we bought it.  I has plenty of power, rides like my brothers 03 Cadillac, and handles better than most other 4x4s.  Except an inconvienent front cup holder (in front of the shift) and a gas tank that is too small (18 gal), it a treat to drive or ride in on long trips whether on long straight-aways in Arizona and Texas, the rolling hills and curves of Oklahoma and Arkansas, or the twisting mountain roads of Colorado.  The GMC Envoy is a definite ""two thumbs up"" vehicle!!",4.75,2002.0,GMC
146209,198765,G6 Sedan GT 4dr Sedan (3.5L 6cyl 4A)," I bought my G6 in March and have put 3k on it so far. I bought it with 94k, and only had one owner who replaced pretty much everything that goes out at that high of mileage. I've had zero problems since I've bought it except my windshield cracked and I had to replace it. It's got all the features, 3.6L V6 engine, monsoon stereo, 6 CD changer, fog lights, power pedals, chrome wheels, etc. Definitely a head turner. It's a very sporty fun car for a daily commute. It's my first nice car I've ever owned and I'd definitely recommend for someone who is looking for a nice, cheap, sporty car. ",4.875,2005.0,Pontiac
139239,188656,Contour Sedan SE 4dr Sedan," Contour was a good car. Would have been great if they had trimmed it out the way it deserved. Needed more options and a nice interior. As a commuter car its been terrific. Going strong at 160,000 miles and still gets 31 mpg.",3.875,2000.0,Ford
190556,261524,Malibu Sedan LT 4dr Sedan (3.5L 6cyl 4A)," Have 70k miles on it, has a rattle that wont quit, remote start works most of the time but is getting worse, turns over just isnt firing. Electric power steering has completely quit working on a 250 mile trip, started working 10 miles from the dealership,  quit working again today from work to home, they said since I have been reporting lots of the same problems they will fix it.  They also told me one time at 40,000k that my injectors were leaking, they don't even now how the car works that they make, it idles high in mornings or when it's cold to warm up faster, and they wanted me to pay for it, it also eats the inside of the front tires like candy since it was new.  ",3.75,2006.0,Chevrolet
2341,3197,Jetta Sedan GLS 4dr Sedan (2.0L 4cyl 5M)," I bought this Jetta as a second vehicle, it is a 5-speed which I like, but the 2.0 engine is severly underpowered for this 3,000 lb. car.  It takes a lot to get this car moving.  Also, the first time it rained, I had a  puddle in the back seat, apparantly they had installed the molding on the window incorectly.  I would buy another Jetta, but i would have to opt for the 1.8T engine, or the VR6.",4.0,2004.0,Volkswagen
68280,94289,Accent Hatchback GS 4dr Hatchback (1.6L 4cyl 6M)," Pros: I do love this little car.  So does my son who just got his driver's license.  GREAT mileage - have hit 47.7 on the highway with only me and no cargo in the car.  Great handling.  Good headroom.  Cons:  Poor rear visibility.  Headlights don't light up front side of car, so can't see into where you're turning until you've already turned.  Tires get flattened very easily - can't even count how many I've replaced.  And they are not cheap.  Around 80,000 car became very loud inside while highway driving.  have to yell to people in the backseat for them to hear.  My 6' 2"" husband gets leg cramps on long drives, even with the seats pushed all the way back.",4.0,2012.0,Hyundai
69214,95725,"Veloster Hatchback 3dr Hatchback w/Red, Black Interior (1.6L 4cyl 6M)"," Bought the car 10 month ago , problems since the beginning !! Already been on the warranty 9 times ,replaced the navigation sistem after 3 fix, rear bumper replaced by the warranty after being melted by the exhaust , melting again btw , engine light on 8 times !the gas meter on the tank has been replaced , damaged again btw !the car shakes like a train after 75 miles !! And hyunday don't pay for the rentals so paying a car monthly plus a rental Evry month ! For a week while the car is on service ! Do not buy ! Still waiting for hyunday to buy it back !First time ever reviewing I hate complaining , but this is to much ! This car is a joke! I should of stay with Honda .",2.125,2012.0,Hyundai
55011,77588,Civic Coupe HX 2dr Coupe," Bought my car at 90k miles, sold at 115k after owning a couple years.  Never had a problem with it, sold it for $200 more than I bought it for.  Took it down the Alaska-Canadian Highway, no problem (though it is very small and the seats are not the most comfortable in the world).  Calculated out 47mpg on some of these road trip stretches.  I had the manual, and really liked the fine, smooth way it shifted.  It was a very fun, responsive, maneuverable little car.  I don't have kids, so the coupe was perfect for me and my dog.  I'm also in the shorter/smaller/younger range, so getting in and out was no problem.  That said, my husband with his back/hip problems disliked riding in it, and my 50 yo father climbed in and out of it once and said that was it for him, no more, my car was going to give him a hernia.  To be fair, if you park it at a curb, you'll actually be climbing UP out of it.  Also, it should be noted that it's not the best/steadiest on snow and ice (probably because of its short/narrow wheel base and light weight), though I drove it two winters in AK and never wound up in a snow bank.  If you want to zip from place to place and do so reliably and efficiently, I highly recommend this car.  Watch who you're buying it from, though.  Mine was all OEM, and I know most of them out there have been modified (unless that's what you're into).",5.0,1998.0,Honda
3665,5012,Golf Diesel GL TDI 4dr Hatchback (1.9L 4cyl Turbodiesel 5M)," This car will surprise you with it's refined diesel engine, the power, the fuel economy, and so much more. If you think diesels are horrific, this car will change your mind.",4.875,2003.0,Volkswagen
160853,219449,350Z Coupe Touring 2dr Coupe (3.5L 6cyl 6M), Good car for the money.   The car drives great and the looks turn heads all the time.  The car is well rounded and always fun.  The only thing that would keep me from buying another one is Nissan's service.  Nissan does not service or support this product very well.,4.25,2004.0,Nissan
168920,230224,XC90 SUV T6 AWD 4dr SUV (2.9L 6cyl Turbo 4A)," NICE SOLID DRIVING CAR, BUT DISSAPPOINTING OVERALL.I HAVE HAD TO TAKE THE CAR BACK FOR WARRANTY WORK NEARLY EVERY OTHER WEEK.  TIRES WERE WORN OUT AT 10,000 MILES.  SEATS DROP ALL MEMORY IF MORE THAN ONE DRIVER USES THE SAME KEYLESS ENTRY.  FIELD OF VISION ON THE SIDE AND SIDE VIEW MIRRORS IS VERY BAD.  I HAVE HAD SEVERAL NEAR MISSES.  WE HAVE THE THIRD ROW SEATING OPTION AND THE INTERIOR FEELS VERY CRAMPED IN ALL THREE ROWS.RUBBER GASKET UNDER ROOF RACK IN THE FRONT MADE A TERRIBLE HUMMING NOISE AND HAD TO BE REPLACED. ",3.0,2003.0,Volvo
158865,217144,Frontier King Cab 4dr King Cab Nismo Rwd SB (4.0L 6cyl 5A)," i got my nismo in 8/05 i have not been easy with it i work on a tobbaco farm and i use it every day driving through the fields at high speed that i would not dare to take a ford or dodge because you would tear the hell out of it.  now power all i have to say i weighed in at the scalls at 14,500 lbs and pulled it better than any half ton truck.  it is a awsome 4 welling machine i have only got stuck twice and that was becouse i sunk stright down to the chasy u could only see about 3 inches of the tires.  it i s a great  truck and well worth the money.",4.75,2005.0,Nissan
73219,100246,XG300 Sedan 4dr Sedan (3.0L 6cyl 5A)," I purchased this car in 2001 as brand new. It rides very nice and I love all the features came with the car...which you find those features as options on other cars... such as automatic climate control, leather seats, wood trims, abs, traction control and etc....I love this car very much and I always hear too nice things about my car from other people who saw and ride in it..",5.0,2001.0,Hyundai
74997,102418,Avalon Sedan Limited 4dr Sedan (3.5L 6cyl 5A)," Thought the new Avalon would have better handling, but it drives like my father's old Buick.  The concept is great... lots of features, good price/ value, should have good reliability, but ""oh what a feeling"" is missing big time.  Mileage is 19 to 20 in town on the road it is 27+/-.  The transmission seems to slip.  Dealer says it is a new 6 speed auto and is supposed to slip(?).  To our  surprise it is not very comfortable on long trips.  Neither of us have back problems but after 3 hours our backs start to hurt.  So this car will be going on Autotrader/ Cars.com soon.  It will be a while before we go back to Toyota. ",3.5,2006.0,Toyota
26374,38200,DeVille Sedan D'elegance 4dr Sedan," That this vehicle  Runs fantastic, very comfy. and good as gas milage goes, I've always drove Lincoln, & Cadillacs, and prefer the Cadillac,, with the fancy grill and her Landau top she is a looker,  quiet running heated seats all the goodies, She's a keeper",5.0,1998.0,Cadillac
108814,146570,TL Sedan 3.2 4dr Sedan, I bought my car at the auto store in Miami and since the first day I got my car I had nothing but problems. I replace my transmission last year in nov of 2008 and my transmission went out again in April of 2009. I think I got played and I still make payments on this car. I can't get out of it.,2.375,1999.0,Acura
137610,186229,Taurus Sedan SE 4dr Sedan (3.0L 6cyl 4A)," The car was great until this week! No issues at all, until going 70 mph on major highway and revved to 7,000rpms, lost all gears except park and neutral. No warning light, no noise. We could have been killed! Just paid $3,000 for new transmission on a car that just turned 65,000 miles. Called Ford to complain,they are sorry, but too bad! No powertrain warranty after 36,000 miles. No recalls on this year/model! Yet hundreds of complaints of same situation on internet. Ford does nothing! This is my first and last Ford!",2.875,2005.0,Ford
156062,213348,Sentra SE-R SE-R 4dr Sedan (2.5L 4cyl 4A)," SO great, I highly recommend for any new drivers like m!",5.0,2004.0,Nissan
6431,8612,Rabbit Hatchback S PZEV 2dr Hatchback (2.5L 5cyl 6A)," Absolutely fantastic car. Fun to drive, great styling, and really great features for the price.",4.875,2008.0,Volkswagen
134957,181726,Fusion Sedan Titanium 4dr Sedan AWD w/EcoBoost (2.0L 4cyl Turbo 6A)," Loses 50% of value in one year. Shifts horribly. Particularly from 2nd-3rd, as well as down shifting on down hills when applying the brakes. Not at all the time, but enough to make you flinch, expecting it to lurch you forward in your seat. Didn't happen during test drive or I definitely would not have purchased. Took it to dealer, was told this was ""normal behavior"" for this transmission and handed a print out of internal service bulletin ststing the same. Note to Ford: If you get so many complaints about an issue there is an ISB created for it, perhaps your definition of ""normal behavior"" should be reevaluated. Cheap feel to materials on interior, especially the doors. When you press on the door to exit, it just feels like dry-rotted foam behind it. Doors don't seal well, lots of dust/dirt spring through fall, doors freeze shut in winter. Trim doesn't  line up, just a general lack of attention to detail. Rides smooth and quiet, perhaps the best on those 2 items of any car I've ever owned. Beyond that...Beautiful aesthetically, useless functionally. Begrudgingly looking to trade in despite the huge financial hit.",1.0,2015.0,Ford
198967,273549,TrailBlazer EXT SUV LT Rwd 4dr SUV (4.2L 6cyl 4A)," Traded in 97 Astro for 04 LT EXT.  Expect a truck like ride, 3rd row seating is easier and sits better than Tahoe.  We like it overall.  We live in Texas, it does not produce cold air until it is moving. Dealer says that is how it was designed, still looking into it.",4.25,2004.0,Chevrolet
103994,139652,Enclave SUV CX 4dr SUV (3.6L 6cyl 6A), If you live in an area that has rain and/or snow - please reconsider purchasing a 2008 Enclave.  This car is terrible on wet roads.   All else seems to be fairly good; no other issues.,3.5,2008.0,Buick
26102,37754,DeVille Sedan 4dr Sedan (4.6L 8cyl 4A)," Of the five Caddilacs I have had, two bles engines at 60,000 to 80000 miles.  It is a great car on the freeway.  This is my last, as soon as I can get rid ofr it.  Mye 2000 lexus, 300, has only had tires and brakes at 88,000 miles.  Goodby Cadillac.",3.25,2005.0,Cadillac
33368,48870,C-Class Sedan C300 Sport 4dr Sedan (3.0L 6cyl 6M)," Let's face it, the reason why we consider this car is for the status symbol.  For the price, this vehicle delivers quality, styling, and great features all packed into an entry level luxury vehicle.  The best features of this car are the multimedia package, build quality, and performance.  The Multimedia boasts a 7.1 surround sound system, DVD, navi, voice command, bluetooth connectivity, and a 6 disc cd changer.  It's always conversational piece with every passenger.  As for build quality, try standing on another car's door panel, and say goodbye to the hinges.  This car will hold a 400lb person with no problem.  Styling?  Ask everyone who stares. The best looking luxury sedan on the market.",4.875,2008.0,Mercedes-Benz
175830,241335,Charger SRT-8 SRT-8 4dr Sedan (6.1L 8cyl 5A), I have owned the car for just three weeks and so far it is fantastic. The ride is good for a performance car and the performance is excellent. I had a 69 Hemi Charger and this car is far superior in most respects. I have an on board performance computer and the car has run 0-60 in 4.8 sec and the 1/4 mile in 12.9 sec. It is a great value for the price.,4.75,2006.0,Dodge
140111,190189,Explorer SUV Sport 4dr SUV AWD (3.5L 6cyl Turbo 6A)," I spent sometime researching the vehicle before making the purchase. I didn’t want to find myself in a vehicle I wasn’t happy with AGAIN. I like to have either AWD or 4WD, but all of the luxury items you would find in a BMW. I traded in a 2015 Ford Edge AWD loaded, for the Ford Explorer Sport. This was the best decision I have ever made! It’s a very attractive looking vehicle inside and out! It’s fast off the line, and you don’t feel like you are riding on the ground because it’s so low especially in the 4WD. The sync 3 is a huge upgrade and way faster than sync 2. The Sony media system, front and rear cameras are amazing. The heated/ cooled seats, and heated steering wheel is also AMAZING! It rides very very nice on the road. My ONLY complaint is the fuel mileage on the 3.5 eco boost turbo isn’t what I thought it would be. That is my ONLY complaint. The interior leather seats and power third row with auto lift gate options are a must. Just wave your foot under the lift gate and it opens as long as you have your key fab with you. I absolutely LOVE this SUV so far. The turn button intelligent 4WD is awesome, you have 4 different terrain settings. We did pay a pretty penny for it, but with 0% and cash back bonus you can’t go wrong. Very glad I waited and found the EXACT one I wanted with all the options I wanted.",5.0,2017.0,Ford
165870,225770,S90 Sedan T5 Momentum 4dr Sedan (2.0L 4cyl Turbo 8A)," Compared this car to others in the same class. I looked at MPG, safety, styling, ride and lease payments. This car was superior in MPG, safety and leasing costs. Dealership salespeople were great (did not treat me with disrespect as other upper end auto dealerships do. I have no affiliation with Volvo and I am very pleased. Also I have no rattles, squeaks or computer problems. This car is a hidden gem.",5.0,2017.0,Volvo
109357,147139,TL Sedan 4dr Sedan w/Nav System (3.2L 6cyl 5A)," All things considered, the car is a joy to drive.  Powerful engine can cause the front end to pull to the left when you floor it. I tend to drive with fuel consumption in mind and this car consistantly gives me around 25 mpg in mixed city/hwy and 30mpg hwy.  A friend who has one drives aggressively and gets much lower results. Overall the car is a great combination of a sport/luxury car. Only disappointment is the nav system. Info was somewhat out of date when delivered and it is very annoying that you must hit a button on the screen to activate it everytime you start the car to acknowledge that you will use it with common sense",5.0,2006.0,Acura
194724,268004,Silverado 1500 Extended Cab LS 3dr Extended Cab Stepside SB," A 1999 Chevy Silverado was my first vehicle i bought one with 220000 on it and the truck looked like crap, rust, mis match doors etc.. but regardless of the miles and complete lack of care it received from previous owners this truck has not needed a thing & runs like a dream even now at 320,000 with the original motor and transmission. Love this truck and it will love you back",5.0,1999.0,Chevrolet
58899,82186,Pilot SUV EX 4WD 4dr SUV (3.5L 6cyl 5A), I had this car for about 15 years and only had to take it to the workshop 10 times. I still drive this car this car and l like it,5.0,2004.0,Honda
177798,243499,QX60 SUV 4dr SUV AWD (3.5L 6cyl CVT)," I wanted this car so bad. Now I have it and I'm over it.  Would turn in now however, I know my husband will be irritated with me as I've begged him to get me this car.  Here's the thing, I've driven Cadillacs, Mercedes, Lincolns... This car is very comfortable for our family, especially for the price.  My issue is with the dealerships.  I miss the Lincoln dealership experience so much!   The other luxury companies offer complimentary maintenance why doesn't INFINITI?  Sorry Infiniti but this is why as soon as I can I will be leaving for the new Navigator or Escalade.  There's no way om earth that i would upgrade to the qx80 and not have the same luxury dealer experience that the other companies offer.  I literally felt like I was back at the pontiac dealership from my college days... not a good thing for a ""luxury"" company.  This may be the reason you had to offer huge discounts on your vehicles as there aren't many of them on the road. ;-)... I'm over INFINITI experience such a rip off plus the technology Infiniti vehicles are several years behind the times.",3.0,2018.0,INFINITI
41551,61525,Tribute SUV LX-V6 4WD 4dr SUV (3.0L 6cyl 4A), I have owned this vehicle for 9 months and have had no problems. I have really enjoyed the 4wd capability this winter because of the terrible weather.,4.625,2001.0,Mazda
152690,208936,Rogue SUV SV 4dr SUV (2.5L 4cyl CVT)," Good vehicle.  Nothing special.  Great on gas, reliable, and comfortable.  Rear ac blows very weakly",4.0,2016.0,Nissan
